{
  "$schema": "https://json-schema.org/draft/2020-12/schema",
  "title": "FleetComparison",
  "type": "object",
  "additionalProperties": false,
  "required": [
    "schema_version",
    "comparison_id",
    "template",
    "requested_at",
    "completed_at",
    "max_age_s",
    "complete",
    "partial_reason",
    "requested_count",
    "included_count",
    "columns",
    "rows",
    "aggregates"
  ],
  "properties": {
    "schema_version": {
      "const": "linux-mcp/fleet-comparison/v1"
    },
    "comparison_id": {
      "type": "string",
      "pattern": "^[0-9a-f]{8}-[0-9a-f]{4}-[0-9a-f]{4}-[0-9a-f]{4}-[0-9a-f]{12}$"
    },
    "template": {
      "type": "object",
      "additionalProperties": false,
      "required": [
        "id",
        "version"
      ],
      "properties": {
        "id": {
          "type": "string",
          "pattern": "^[a-z][a-z0-9-]{2,63}$"
        },
        "version": {
          "type": "integer",
          "minimum": 1
        }
      }
    },
    "requested_at": {
      "type": "string",
      "pattern": "^\\d{4}-\\d{2}-\\d{2}T\\d{2}:\\d{2}:\\d{2}\\.\\d{3}Z$"
    },
    "completed_at": {
      "type": [
        "string",
        "null"
      ],
      "pattern": "^\\d{4}-\\d{2}-\\d{2}T\\d{2}:\\d{2}:\\d{2}\\.\\d{3}Z$"
    },
    "max_age_s": {
      "type": "integer",
      "minimum": 1,
      "maximum": 3600
    },
    "complete": {
      "type": "boolean"
    },
    "partial_reason": {
      "type": [
        "string",
        "null"
      ],
      "enum": [
        "target_failed",
        "target_unavailable",
        "target_unsupported",
        "budget_exhausted",
        "stale_data",
        "authorization_lost",
        null
      ]
    },
    "requested_count": {
      "type": "integer",
      "minimum": 1,
      "maximum": 20
    },
    "included_count": {
      "type": "integer",
      "minimum": 0,
      "maximum": 20
    },
    "columns": {
      "type": "array",
      "minItems": 1,
      "maxItems": 8,
      "items": {
        "type": "object",
        "additionalProperties": false,
        "required": [
          "field",
          "label",
          "unit"
        ],
        "properties": {
          "field": {
            "type": "string",
            "pattern": "^(/[A-Za-z0-9_.-]+)+$"
          },
          "label": {
            "type": "string",
            "maxLength": 40
          },
          "unit": {
            "type": [
              "string",
              "null"
            ],
            "maxLength": 16
          }
        }
      }
    },
    "rows": {
      "type": "array",
      "minItems": 1,
      "maxItems": 20,
      "items": {
        "type": "object",
        "additionalProperties": false,
        "required": [
          "server_id",
          "server_revision",
          "status",
          "collected_at",
          "age_s",
          "values",
          "error_code"
        ],
        "properties": {
          "server_id": {
            "type": "string",
            "pattern": "^[0-9a-f]{8}-[0-9a-f]{4}-[0-9a-f]{4}-[0-9a-f]{4}-[0-9a-f]{12}$"
          },
          "server_revision": {
            "type": "integer",
            "minimum": 1
          },
          "status": {
            "type": "string",
            "enum": [
              "collected",
              "failed",
              "unavailable",
              "unsupported",
              "skipped_budget",
              "stale"
            ]
          },
          "collected_at": {
            "type": [
              "string",
              "null"
            ],
            "pattern": "^\\d{4}-\\d{2}-\\d{2}T\\d{2}:\\d{2}:\\d{2}\\.\\d{3}Z$"
          },
          "age_s": {
            "type": [
              "integer",
              "null"
            ],
            "minimum": 0
          },
          "values": {
            "type": [
              "object",
              "null"
            ],
            "additionalProperties": {
              "type": [
                "number",
                "string",
                "null"
              ]
            }
          },
          "error_code": {
            "type": [
              "string",
              "null"
            ],
            "enum": [
              "unauthenticated",
              "forbidden",
              "not_found",
              "validation",
              "revision_conflict",
              "approval_required",
              "unavailable",
              "timeout",
              "outcome_unknown",
              null
            ]
          }
        }
      }
    },
    "aggregates": {
      "type": "array",
      "maxItems": 24,
      "items": {
        "type": "object",
        "additionalProperties": false,
        "required": [
          "field",
          "kind",
          "value",
          "included_count",
          "requested_count"
        ],
        "properties": {
          "field": {
            "type": "string",
            "pattern": "^(/[A-Za-z0-9_.-]+)+$"
          },
          "kind": {
            "type": "string",
            "enum": [
              "min",
              "max",
              "mean"
            ]
          },
          "value": {
            "type": [
              "number",
              "null"
            ]
          },
          "included_count": {
            "type": "integer",
            "minimum": 0,
            "maximum": 20
          },
          "requested_count": {
            "type": "integer",
            "minimum": 1,
            "maximum": 20
          }
        }
      }
    }
  }
}
